{
 "schema": "promosignal-model/1",
 "name": "ชุดโมเดล B — โครงสร้างคณะกรรมการ (ตัวอย่างอ้างอิง)",
 "key": "Bref",
 "produced_by": "Python 3.11 · statsmodels NegativeBinomial",
 "produced_at": "2026-08-23",
 "target": {
  "var": "n_partners",
  "label": "จำนวนนวัตกรรมเปิด (พันธมิตร / JV / MOU)",
  "family": "negbin",
  "link": "log",
  "scale": "count"
 },
 "alpha": 1.0885,
 "intercept": 0.444141760507169,
 "variables": [
  {
   "key": "promotion",
   "label": "Promotion focus (ภาษาเชิงรุก)",
   "unit": "",
   "min": 0,
   "max": 2.3,
   "step": 0.01,
   "dec": 3,
   "center": 0.538389,
   "sd": 0.35,
   "control": false,
   "bool": false
  },
  {
   "key": "female_pct",
   "label": "สัดส่วนกรรมการหญิง",
   "unit": "%",
   "min": 0,
   "max": 70,
   "step": 1,
   "dec": 1,
   "center": 20.668673,
   "sd": 13.775,
   "control": false,
   "bool": false
  },
  {
   "key": "wa_board_tenure",
   "label": "อายุงานเฉลี่ยของบอร์ด",
   "unit": "ปี",
   "min": 0,
   "max": 30,
   "step": 0.5,
   "dec": 1,
   "center": 9.680629,
   "sd": 5.759,
   "control": false,
   "bool": false
  },
  {
   "key": "indep_pct",
   "label": "สัดส่วนกรรมการอิสระ",
   "unit": "%",
   "min": 0,
   "max": 80,
   "step": 1,
   "dec": 1,
   "center": 43.436419,
   "sd": 10.735,
   "control": false,
   "bool": false
  },
  {
   "key": "board_size",
   "label": "ขนาดคณะกรรมการ",
   "unit": "คน",
   "min": 3,
   "max": 20,
   "step": 1,
   "dec": 0,
   "center": 10.796667,
   "sd": 2.596,
   "control": false,
   "bool": false
  },
  {
   "key": "pol_tie",
   "label": "มีกรรมการเชื่อมโยงการเมือง",
   "unit": "",
   "min": 0,
   "max": 1,
   "step": 1,
   "dec": 0,
   "center": 0.413333,
   "sd": 0.493,
   "control": false,
   "bool": true
  },
  {
   "key": "ln_assets",
   "label": "ขนาดบริษัท (ln สินทรัพย์)",
   "unit": "",
   "min": 12,
   "max": 24,
   "step": 0.1,
   "dec": 2,
   "center": 23.841668,
   "sd": 1.663,
   "control": true,
   "bool": false
  },
  {
   "key": "firm_age",
   "label": "อายุบริษัท",
   "unit": "ปี",
   "min": 1,
   "max": 90,
   "step": 1,
   "dec": 0,
   "center": 32.366667,
   "sd": 16.426,
   "control": true,
   "bool": false
  },
  {
   "key": "roa",
   "label": "ROA",
   "unit": "%",
   "min": -30,
   "max": 40,
   "step": 0.1,
   "dec": 2,
   "center": 6.587216,
   "sd": 7.314,
   "control": true,
   "bool": false
  },
  {
   "key": "de_ratio_w",
   "label": "หนี้สินต่อทุน",
   "unit": "เท่า",
   "min": 0,
   "max": 6,
   "step": 0.05,
   "dec": 2,
   "center": 1.036857,
   "sd": 1.0,
   "control": true,
   "bool": false
  }
 ],
 "terms": [
  "promotion",
  "female_pct",
  "wa_board_tenure",
  "indep_pct",
  "board_size",
  "pol_tie",
  "ln_assets",
  "firm_age",
  "roa",
  "de_ratio_w"
 ],
 "coef": {
  "promotion": 0.1335907982390385,
  "female_pct": 0.0054329809261370095,
  "wa_board_tenure": -0.031359250698763594,
  "indep_pct": 0.016206119490898948,
  "board_size": 0.06357729479897548,
  "pol_tie": -0.15526065970656774,
  "ln_assets": -0.0014160553054596867,
  "firm_age": 0.0048210122983123735,
  "roa": 0.00606132975295432,
  "de_ratio_w": 0.05718689003505254
 },
 "se": {
  "promotion": 0.13718512625778628,
  "female_pct": 0.003702308083944282,
  "wa_board_tenure": 0.009170559743735554,
  "indep_pct": 0.005079597881373088,
  "board_size": 0.022927682775516697,
  "pol_tie": 0.1021444927974732,
  "ln_assets": 0.04478225576469618,
  "firm_age": 0.003101921599637231,
  "roa": 0.007037628607367703,
  "de_ratio_w": 0.053566968800467935
 },
 "p": {
  "promotion": 0.3301561344283144,
  "female_pct": 0.14225155724952948,
  "wa_board_tenure": 0.0006272321695606885,
  "indep_pct": 0.001420595064881551,
  "board_size": 0.00555508276574613,
  "pol_tie": 0.1285084397044082,
  "ln_assets": 0.9747743746125812,
  "firm_age": 0.12013627563924824,
  "roa": 0.3890869006868418,
  "de_ratio_w": 0.2857111425216877
 },
 "vcov": {
  "order": [
   "Intercept",
   "promotion",
   "female_pct",
   "wa_board_tenure",
   "indep_pct",
   "board_size",
   "pol_tie",
   "ln_assets",
   "firm_age",
   "roa",
   "de_ratio_w"
  ],
  "matrix": [
   [
    0.027835643542173893,
    0.002418025003208154,
    5.9370331416982735e-06,
    0.0001901477065799126,
    -1.5764221425935835e-05,
    3.6690746356288434e-05,
    -0.002982852720806989,
    -0.0019631821151275233,
    6.752654949378738e-05,
    2.0215086959707246e-05,
    -0.0008074257850848835
   ],
   [
    0.002418025003208154,
    0.018819758866364767,
    6.9000853343787785e-06,
    -1.3093312711592062e-05,
    -3.241377872650197e-05,
    3.120246393640186e-05,
    -0.00011940915417927645,
    0.00035136339785641973,
    -6.537741172796058e-06,
    -1.1076738016392296e-05,
    -0.0005840399744913996
   ],
   [
    5.9370331416982735e-06,
    6.9000853343787785e-06,
    1.3707085148439182e-05,
    1.2926669654527152e-06,
    -2.069582238147993e-07,
    -5.4730713741070394e-06,
    1.8599968010646652e-05,
    1.8263165560260266e-05,
    2.8698502633782073e-07,
    -2.7018824536174935e-06,
    -2.221134267649626e-05
   ],
   [
    0.0001901477065799126,
    -1.3093312711592062e-05,
    1.2926669654527152e-06,
    8.409916601342311e-05,
    8.537003305509295e-06,
    1.352584763348141e-06,
    -2.3616618955968116e-05,
    1.8691664073971168e-05,
    -8.974704637052245e-06,
    -5.328120475993814e-06,
    -1.6550255528312413e-05
   ],
   [
    -1.5764221425935835e-05,
    -3.241377872650197e-05,
    -2.069582238147993e-07,
    8.537003305509295e-06,
    2.5802314636449962e-05,
    1.2870753571937153e-05,
    -7.534595694717122e-05,
    -4.96178118538891e-05,
    1.046669785925243e-06,
    -1.4797750473268188e-06,
    4.7665267717112475e-06
   ],
   [
    3.6690746356288434e-05,
    3.120246393640186e-05,
    -5.4730713741070394e-06,
    1.352584763348141e-06,
    1.2870753571937153e-05,
    0.000525678637454725,
    -0.00028973356784311327,
    -0.0004854174059346822,
    -3.1942210017147972e-06,
    1.4669859094267343e-06,
    0.0001303605888339048
   ],
   [
    -0.002982852720806989,
    -0.00011940915417927645,
    1.8599968010646652e-05,
    -2.3616618955968116e-05,
    -7.534595694717122e-05,
    -0.00028973356784311327,
    0.010433497408853054,
    0.00047968424882719303,
    -2.478630401628754e-06,
    4.4293819022592874e-05,
    0.00011725346101695711
   ],
   [
    -0.0019631821151275233,
    0.00035136339785641973,
    1.8263165560260266e-05,
    1.8691664073971168e-05,
    -4.96178118538891e-05,
    -0.0004854174059346822,
    0.00047968424882719303,
    0.0020054504313746645,
    -2.4497279820943946e-05,
    4.8621020600026426e-05,
    -0.000556838340025998
   ],
   [
    6.752654949378738e-05,
    -6.537741172796058e-06,
    2.8698502633782073e-07,
    -8.974704637052245e-06,
    1.046669785925243e-06,
    -3.1942210017147972e-06,
    -2.478630401628754e-06,
    -2.4497279820943946e-05,
    9.621917610295998e-06,
    1.7458999595959966e-06,
    1.781098876306717e-05
   ],
   [
    2.0215086959707246e-05,
    -1.1076738016392296e-05,
    -2.7018824536174935e-06,
    -5.328120475993814e-06,
    -1.4797750473268188e-06,
    1.4669859094267343e-06,
    4.4293819022592874e-05,
    4.8621020600026426e-05,
    1.7458999595959966e-06,
    4.9528216415240265e-05,
    9.461176680509158e-05
   ],
   [
    -0.0008074257850848835,
    -0.0005840399744913996,
    -2.221134267649626e-05,
    -1.6550255528312413e-05,
    4.7665267717112475e-06,
    0.0001303605888339048,
    0.00011725346101695711,
    -0.000556838340025998,
    1.781098876306717e-05,
    9.461176680509158e-05,
    0.002869420146470305
   ]
  ]
 },
 "fixed_effects": {
  "year": {
   "2020": 0.0,
   "2021": -0.04660380763570759,
   "2022": 0.11465936051145073,
   "2023": 0.24870037790889457,
   "2024": 0.05928505330026184
  },
  "industry": {
   "ทรัพยากร": 0.0,
   "บริการ": 0.3996657774700293,
   "สินค้าอุตสาหกรรม": -0.2276539031422934,
   "สินค้าอุปโภคบริโภค": -0.0032419543665411234,
   "อสังหาริมทรัพย์และก่อสร้าง": -0.36056188014489854,
   "เกษตรและอุตสาหกรรมอาหาร": -1.4391492853674857,
   "เทคโนโลยี": -0.5342252140159486
  }
 },
 "fit": {
  "n": 900,
  "n_firms": 201,
  "pseudo_r2": 0.0487,
  "llf": -1411.7
 },
 "oos": {
  "n_test": 391,
  "pseudo_r2": -0.0514,
  "mae": 1.545,
  "mase": 1.076,
  "spearman": 0.3419,
  "c_index": 0.6499,
  "pi90_coverage": 0.9488
 },
 "reference": {
  "quantiles": [
   0.19789,
   0.28397,
   0.31304,
   0.33307,
   0.35807,
   0.37596,
   0.39539,
   0.42953,
   0.43746,
   0.46476,
   0.48106,
   0.49339,
   0.5192,
   0.54633,
   0.56766,
   0.60641,
   0.64189,
   0.69383,
   0.71341,
   0.74468,
   0.78838,
   0.80592,
   0.83485,
   0.85257,
   0.86646,
   0.88012,
   0.89445,
   0.91125,
   0.92351,
   0.931,
   0.95014,
   0.95984,
   0.983,
   1.00169,
   1.02025,
   1.03957,
   1.05112,
   1.06435,
   1.07129,
   1.08625,
   1.10276,
   1.11262,
   1.12447,
   1.15422,
   1.16817,
   1.18647,
   1.19781,
   1.20841,
   1.22234,
   1.24519,
   1.25862,
   1.2901,
   1.3271,
   1.35011,
   1.36501,
   1.37464,
   1.39781,
   1.41776,
   1.45117,
   1.47337,
   1.49796,
   1.51934,
   1.54816,
   1.56469,
   1.59419,
   1.63526,
   1.65808,
   1.68706,
   1.70233,
   1.73193,
   1.75156,
   1.76443,
   1.79021,
   1.82656,
   1.86159,
   1.88102,
   1.91021,
   1.9553,
   1.97019,
   2.02121,
   2.04636,
   2.14167,
   2.1808,
   2.22415,
   2.30079,
   2.33672,
   2.40281,
   2.46029,
   2.51067,
   2.58726,
   2.68794,
   2.80799,
   2.89845,
   3.00102,
   3.15516,
   3.23698,
   3.36117,
   3.57492,
   3.8549,
   4.21515,
   6.35963
  ],
  "mean": 1.4795,
  "median": 1.2586,
  "quintile_edges": [
   0.78838,
   1.10276,
   1.49796,
   2.04636
  ]
 },
 "notes": "ไฟล์นี้คือชุดโมเดล B ที่ฝังอยู่ในแอปอยู่แล้ว แปลงเป็นรูปสัญญาเพื่อใช้เป็นตัวอย่าง ให้ผู้เขียนสคริปต์ R / Stata เทียบรูปแบบ — โหลดเข้าไปแล้วค่าที่ได้ต้องตรงกับชุด B ทุกตำแหน่ง"
}